actividad	centro	dni	quien	importe	date	tipo
Concierto de Tonhalle Orchester Zurich- Temp Primavera	Zaragoza Cultural		Aijonmusic, SA 	70000	19/03/2018	Privado(Negociado sin publicidad)
Concierto de James Rhodes-Ciclo Solistas	Zaragoza Cultural		Muzmuki, S.L. 	25856	19/03/2018	Privado(Negociado sin publicidad)
Coorganización Festival Slap! Indoor 2018	Zaragoza Cultural		Dominguez Gracia, Victor - ES	10988	15/03/2018	Otros(Menor)
Concierto Orquesta Reino de Aragón (opera Carmen)	Zaragoza Cultural		Gesmar Servicios Culturales, S.L. - ES	3202	09/03/2018	Servicios(Menor)
Feria de la Vivienda	Zaragoza Cultural		Zesis, s.l. - ES	13055	09/03/2018	Servicios(Menor)
Concierto Al Ayre Español. Temp Primavera	Zaragoza Cultural		Laurel de Apolo, s.l. 	10500	26/02/2018	Privado(Negociado sin publicidad)
Concierto de Orquesta Sinfónica Radio de Finlandia-Temp Primavera	Zaragoza Cultural		Aijonmusic, SA 	68000	26/02/2018	Privado(Negociado sin publicidad)
Concierto de Les Musiciens du Louvre- Temp. Primavera	Zaragoza Cultural		Duetto Management, S .L. - ES	14700	26/02/2018	Privado(Negociado sin publicidad)
Suministro de un interacumulador para ACS en el espacio designado del Auditorio de Zaragoza.	Zaragoza Cultural		FERROVIAL SERVICIOS SA	3895	26/02/2018	Suministros(Menor)
"Servicio en régimen de alquiler de material de iluminación, video y personal técnico para la actividad ""Ópera Cármen"""	Zaragoza Cultural		RAMPA HUESCA S.L.	4100	26/02/2018	Servicios(Menor)
Control de Aves para la prestación de servicios en las instalaciones exteriores del Museo del Teatro Caesaraugusta de Zaragoza	Zaragoza Cultural		Desinfecciones Daymax 	3225	26/02/2018	Servicios(Abierto)
Colaborador oficial Ayuntamiento de Zaragoza Fiestas del Pilar 2018 y otras actividades	Zaragoza Cultural		Mercazaragoza 	19504	23/02/2018	Privado(Restringido)
Asistencia técnica a la Mesa de Coordinación y a las Mesas Sectoriales	Zaragoza Cultural		AD HOC GESTIÓN CULTURAL S. L.	12800	19/02/2018	Servicios(Menor)
Coorganización programa actividades culturales 2018.	Zaragoza Cultural		Federación Interpeñas de Zaragoza 	45454	12/02/2018	Privado(Negociado sin publicidad)
Suministro e instalación del equipamiento escénico, audiovisual, comunicaciones y otros para Harinera de San Jose de Zaragoza	Zaragoza Cultural		Tecesa, S.L.U. 	126208	02/02/2018	Suministros(Abierto)
Concierto de Gürzenich Orchester Köln-Temp Primavera	Zaragoza Cultural		Peris Orht Konzert 	63000	26/01/2018	Privado(Negociado sin publicidad)
Concierto de los Niños cantores de Viena -cim	Zaragoza Cultural		Aijonmusic, SA 	25000	26/01/2018	Privado(Negociado sin publicidad)
Coorganización 4ª edición ciclo De la Raiz	Zaragoza Cultural		Producciones Panoja, S.L. - ES	33000	15/01/2018	Privado(Negociado sin publicidad)
Suministro e instalación del Mobiliario para Harinera de San Jose de Zaragoza.	Zaragoza Cultural		Tecnidiseño Plus 	54075	15/01/2018	Suministros(Abierto)
Concierto de London Philharmonic Orchestra- Temp Otoño	Zaragoza Cultural		Aijonmusic, SA 	90000	12/01/2018	Privado(Negociado sin publicidad)
Joven Orquesta Nacional de España. Temporada Otoño y cim	Zaragoza Cultural		Viajes Halcón, SAU. 	19090	04/01/2018	Privado(Negociado sin publicidad)
Concierto de Yuja Wang y la Chamber Orchestra of Europa- Temp Otoño	Zaragoza Cultural		Sanzkonzert, S.L. 	60000	04/01/2018	Privado(Negociado sin publicidad)
SERVICIOS DE ASISTENCIA TÉCNICA PARA LA ADAPTACIÓN, MODIFICACIÓN Y REDACCIÓN DE LOS PROYECTOS DE INGENIERÍA Y/O MEMORIAS COMPLEMENTARIOS A DOS PROYECTOS DE EJECUCIÓN SITUADOS EN C/CONTAMINA 4 Y EDIFIC	Zaragoza Vivienda		PEDRO FUNES, S.L.	10350	14/12/2018	Servicios(Negociado sin publicidad)
SERVICIOS DE ASISTENCIA TÉCNICA PARA LA ADAPTACIÓN, MODIFICACIÓN Y REDACCIÓN DE PROYECTOS DE INGENIERÍA Y/O MEMORIAS COMPLEMENTARIOS A TRES PROYECTOS DE EJECUCIÓN SITUADOS EN C/ HORNO 9, C/ HORNO 14-1	Zaragoza Vivienda		DISEÑO, DESARROLLO Y DIRECCION DE INSTALACIONES S.L.	14900	04/12/2018	Servicios(Negociado sin publicidad)
SERVICIO ALQUILER CONTENEDORES PISL	Zaragoza Vivienda		TRANSPORTES  BUERA SANCHO, S.A.	1700	03/12/2018	Servicios(Menor)
SUMINISTRO DE CAMISETAS TÉCNICAS DEPORTIVAS PARA REPRESENTAR A ZARAGOZA VIVIENDA EN LA CARRERA DE EMPRESA CONVOCADA POR ESIC	Zaragoza Vivienda		G.M.P. PUBLICIDAD 	130	30/11/2018	Suministros(Menor)
SUMINISTRO DE MOBILIARIO PARA PISOS COMPARTIDOS DENTRO DEL CONVENIO CON EL INJUVE DESTINADO A FAVORECER LA AUTONOMÍA DE JÓVENES EN ALOJAMIENTO TEMPORAL	Zaragoza Vivienda		HIPOPÓTAMO EUROPA S.L.	3151	21/11/2018	Suministros(Menor)
SERVICIOS DE CONSULTORÍA Y ASISTENCIA JURÍDICA PARA LA ADECUACIÓN, ADAPTACIÓN Y POSTERIOR ACTUALIZACIÓN Y MANTENIMIENTO AL REGLAMENTO (UE) 2016/679 DEL PARLAMENTO EUROPEO Y DEL CONSEJO DE 27 DE ABRIL	Zaragoza Vivienda		OESIA NETWORKS, S.L.	33591	09/11/2018	Servicios(Abierto)
"SERVICIOS DE COMPRA DE ESPACIOS EN MEDIOS DE COMUNICACIÓN Y DEMÁS SOPORTES PUBLICITARIOS PARA LA DIFUSIÓN DE LA CAMPAÑA PUBLICITARIA DEL PROGRAMA ""ALEGRA TU VIVIENDA"""	Zaragoza Vivienda		Havas Media Proximia	24000	08/11/2018	Servicios(Abierto Simplificado)
SUMINISTRO DE LONA INFORMATIVA DE OBRAS DE REHABILITACIÓN ENERGÉTICA QUE HAN RECIBIDO AYUDAS DE LA SOCIEDAD MUNICIPAL ZARAGOZA VIVIENDA S.L.U.	Zaragoza Vivienda		G.M.P. PUBLICIDAD 	640	07/11/2018	Suministros(Menor)
SUMINISTRO DE DESTRUCTORA DE PAPEL PARA ÁREA ECONÓMICO FINANCIERA	Zaragoza Vivienda		OFIGOYA, S.L.	90	06/11/2018	Suministros(Menor)
SUMINISTRO DE PINTURAS Y MATERIAL ACCESORIO PARA LA EJECUCIÓN DEL PLAN DE EMPLEO SOCIOLABORAL 2018	Zaragoza Vivienda		HIPOPOTAMO PINTURAS Y DECORACION	15000	30/10/2018	Suministros(Abierto Simplificado)
SUMINISTRO DE PINTURAS Y MATERIAL ACCESORIO PARA LA EJECUCIÓN DEL PLAN DE EMPLEO SOCIOLABORAL 2018	Zaragoza Vivienda		BLANCO FERRETERIA S.L.	15000	30/10/2018	Suministros(Abierto Simplificado)
SUMINISTRO DE CALZADO DE SEGURIDAD PARA TRABAJADORES DE LA SOCIEDAD MUNICIPAL ZARAGOZA VIVIENDA S.L.U.	Zaragoza Vivienda		FERRETERÍA COMERCIAL VIÑAS S.L.	140	18/10/2018	Suministros(Menor)
SERVICIO DE CONEXIÓN WIFI DE 12 VIVIENDAS PROPIEDAD DE LA SOCIEDAD MUNICIPAL ZARAGOZA VIVIENDA, S.L.U.	Zaragoza Vivienda		PEPEMOBILE, S.L.	4117	17/10/2018	Servicios(Menor)
 Suministro de muebles de cocina y material accesorio para las actuaciones a realizar en viviendas propiedad de Zaragoza Vivienda S.L.U	Zaragoza Vivienda		SUCESORES CASA MARTÍNEZ, S.C.L.	14399	15/10/2018	Suministros(Menor)
SERVICIO DE REPARACIÓN EQUIPO MULTIFUNCIONAL KONICA MINOLTA BH227	Zaragoza Vivienda		ARAMAC, SL.	289	10/10/2018	Servicios(Menor)
SUMINISTRO DE UN TERMINAL DE TELEFONÍA MÓVIL CON PROTECTOR DE PANTALLA PARA USO CORPORATIVO	Zaragoza Vivienda		MEDIA MARKT ZARAGOZA	123	17/09/2018	Suministros(Menor)
SERVICIOS DE ASISTENCIA TÉCNICA PARA LA REDACCIÓN DE LA AUDITORÍA ENERGÉTICA, MODELADO Y SIMULACIONES COMPLEMENTARIAS DEL EDIFICIO SITO EN C/ MAESTRO TELLERÍA 12-20 DE LA CIUDAD DE ZARAGOZA.	Zaragoza Vivienda		EUROQUALITY SARL	3000	03/09/2018	Servicios(Menor)
Suministro de menaje para equipamiento de viviendas	Zaragoza Vivienda		IKEA IBÉRICA S.A	691	18/07/2018	Suministros
Suministro sillas de comedor  para centro comunitario ubicado en el edificio sito en calle Antonio leyva nº 92	Zaragoza Vivienda		CASTILLA INSTALACIÓN DE OFICINAS S.A.	450	09/07/2018	Suministros
Suministro estantería metálica  para centro comunitario ubicado en el edificio sito en calle Antonio leyva n.º 92	Zaragoza Vivienda		FERRETERÍA COMERCIAL VIÑAS S.L.	91	09/07/2018	Suministros
Suministro de altavoz portátil con batería y microfonía para actividades comunitarias	Zaragoza Vivienda		NAGIMA PROYECT SL	247	04/07/2018	Suministros
Suministro de almohadas para acondicionamiento de 9 viviendas destinadas a programas sociales propiedad de Zaragoza Vivienda.	Zaragoza Vivienda		JUAN ANDRÉS ROMEO SEBASTIAN	195	04/07/2018	Suministros
Suministro de 100 memorias USB de 4 GB de capacidad perSonalizados  con el logotipo de la Sociedad Municipal Zaragoza Vivienda, S.L.U.	Zaragoza Vivienda		LYRECO ESPAÑA S.A.	387	26/06/2018	Suministros
Suministro y mantenimiento de tres botellas de  gas medicinal para los equipos de cardioprotección instalados en las sedes de Zaragoza Vivienda	Zaragoza Vivienda		PRAXAIR ESPAÑA, SL.	586	15/06/2018	Suministros
"Servicio de dinamización de la campaña ""Alegra tu vivienda"" promovida por la Sociedad Municipal Zaragoza Vivienda S. L. U."	Zaragoza Vivienda		PEDRO MANUEL CORTÉS MOLES	6150	13/06/2018	Servicios
Suministro de mobiliario de oficina con destino a la Sociedad Municipal Zaragoza Vivienda, S.L.U 	Zaragoza Vivienda		TORRES EQUIPAMIENTOS DE OFICINAS, S.L.	2727	11/06/2018	Suministros(Menor)
SUMINISTRO DE PINTURA REFLEXIVA AISLANTE PARA EXTERIORES, PARA SU USO EN EDIFICIOS PROPIEDAD DE ZARAGOZA VIVIENDA.	Zaragoza Vivienda		MATERIAL INNOVATIVE GESELLSCHAFT MBH	4893	31/05/2018	Suministros(Menor)
Servicio de pegado de carteles	Zaragoza Vivienda		ARAGÓN DIGITAL, S.L.	653	24/05/2018	Servicios
"Servicios de publicidad de la campaña ""Alegra tu vivienda"" de Zaragoza Vivienda, S.L.U. "	Zaragoza Vivienda		GRÁFICAS PELLICER, S.L.	1025	23/05/2018	Servicios(Menor)
Suministro  de cajón archivador de acero para área de Gestión Social y Alquileres	Zaragoza Vivienda		LYRECO ESPAÑA S.A.	288	22/05/2018	Suministros
Curso de formación presencial de atención al ciudadano para la Unidad de Información y Atención al Ciudadano y Recepción, de la Sociedad Municipal Zaragoza Vivienda S. L. U.	Zaragoza Vivienda		AYANET RECURSOS HUMANS S.L.	3300	16/05/2018	Servicios
Contratación de seguridad para la obra de rehabilitación energética situado en la calle Tellería 12-20 de Zaragoza a ejecutar por Zaragoza Vivienda, S.L.U	Zaragoza Vivienda		COMPAÑÍA INTEGRAL DE SEGURIDAD S.L.	10974	04/05/2018	Servicios
Suministro de mobiliario para acondicionamiento de viviendas propiedad o gestionadas por la Sociedad Municipal Zaragoza Vivienda, S.L.U.	Zaragoza Vivienda		Muebles Nebra S.L.	67500	26/04/2018	Suministros(Abierto)
Suministro de material informático para varios puestos de trabajo de la Sociedad Municipal Zaragoza Vivienda S.L.U.	Zaragoza Vivienda		HIBERUS SISTEMAS INFORMÁTICOS S. L.	2982	06/04/2018	Suministros
SUMINISTRO DE EQUIPO MULTIFUNCIONAL PARA UTILIZACIÓN POR DEPARTAMENTOS DE LA SOCIEDAD MUNICIPAL ZARAGOZA VIVIENDA S.L.U.	Zaragoza Vivienda		CANON ESPAÑA, S.A	3000	06/04/2018	Suministros(Negociado sin publicidad)
Suministro de terminales de telefonía móvil para uso corporativo	Zaragoza Vivienda		AMAZON E.U. S.A.R.L.	845	02/04/2018	Suministros
SERVICIO POSTAL DE RECOGIDA, TRATAMIENTO, ADMISIÓN, CLASIFICACIÓN, CURSO, TRANSPORTE, DISTRIBUCIÓN Y ENTREGA DE SU CORRESPONDENCIA ORDINARIA Y CERTIFICADA	Zaragoza Vivienda		CORREOS (GRUPO SEPI)	15000	26/03/2018	Servicios(Menor)
Servicio de elaboración de un programa de dinamización de actividades participativas en torno al proyecto” Azoteas Verdes” 	Zaragoza Vivienda		EL GANCHILLO SOCIAL	12000	23/03/2018	Servicios(Menor)
Servicio de asesoramiento para la modificación y redacción de Proyectos existentes de las obras a realizar por la Sociedad Municipal para la ampliación del parque público de vivienda social de alquil	Zaragoza Vivienda		BHAUS ARQUITECTURA EFICIENTE,S.L	16500	22/03/2018	Servicios(Abierto)
Servicio de asesoramiento para la modificación y redacción de Proyectos existentes de las obras a realizar por la Sociedad Municipal para la ampliación del parque público de vivienda social de alquil	Zaragoza Vivienda		JOAQUÍN SÁNCHEZ CLIMENT Y OTROS	18750	22/03/2018	Servicios(Abierto)
Servicio de asesoramiento para la modificación y redacción de Proyectos existentes de las obras a realizar por la Sociedad Municipal para la ampliación del parque público de vivienda social de alquil	Zaragoza Vivienda		ALBERTO HAERING Y OTROS	16500	22/03/2018	Servicios(Abierto)
Servicio consistente en la realización de tasaciones de inmuebles y solares propiedad de la Sociedad Municipal Zaragoza Vivienda, S.L.U.	Zaragoza Vivienda		TÉCNICOS EN TASACIÓN S.A.	6000	13/03/2018	Servicios
Curso de formación de prevención frente al coso sexual y por razón de sexo, en el ámbito laboral (Modalidad presencial)	Zaragoza Vivienda		FUNDACIÓN ARAGONESA PARA LA FORMACIÓN Y EL EMPLEO	2510	07/03/2018	Servicios
Servicio de orientación y asesoramiento psicosocial a los/as empleados/as de Zaragoza Vivienda	Zaragoza Vivienda		MAS PREVENCIÓN SERVICIO DE PREVENCION, S.L.U.	2100	01/03/2018	Servicios
Suministro de siete extintores de 5 Kg de CO2 y un extintor de 6 Kg de polvo, para reposición en edificios propiedad o gestionados por Sociedad Municipal Zaragoza Vivienda, S.L.U.	Zaragoza Vivienda		OASYS GROUP PCI, S.L.	317	27/02/2018	Suministros(Menor)
Servicio consistente en la realización del diseño y gestión del Boletín Interno y colaboración en la gestión de redes sociales para el desarrollo del Proyecto de Comunicación Interna y Externa de Zaragoza Vivienda dentro del Plan Estratégico 2017-2020	Zaragoza Vivienda		PINEAPPLE, COMUNICACIÓN, S.L.	2500	06/02/2018	Servicios
Suministro de componentes electrónicos para la realización de talleres de difusión del juego Tribe en colegios en el marco del Proyecto TRIBE N.º Contrato 649770 financiado por la Comisión Europea bajo el Programa Horizonte 2020	Zaragoza Vivienda		ENDEF ENGINEERING S.L.	720	31/01/2018	Suministros
Servicio especializado de asistencia técnica para la realización del Balance del Bien Común 2017	Zaragoza Vivienda		ANTONIO BRETÓN HERNÁNDEZ	3000	30/01/2018	Servicios
Servicio de tasaciones de varios activos inmobiliarios propiedad de la Sociedad Municipal Zaragoza Vivienda, S.L.U. para evaluar su test de deterioro	Zaragoza Vivienda		TÉCNICOS EN TASACIÓN S.A.	500	25/01/2018	Servicios
Servicio consistente en la realización de una certificación georreferenciada de distintos solares de Zaragoza propiedad de la Sociedad Municipal Zaragoza Vivienda S.L.U.	Zaragoza Vivienda		INGENIEROS SUPERIORES EN CARTOGRAFÍA, S.C.P	3000	18/01/2018	Servicios
Servicio de re direccionamiento de IP para soporte y asistencia técnica a las cámaras de vigilancia instaladas en los garajes y trasteros de la Calle Armas, propiedad de la Sociedad Municipal Zaragoza Vivienda  S.L.U.	Zaragoza Vivienda		SESE SEGURIDAD IBERIA S.L.U	204	15/01/2018	Servicios
VIGILANCIA DE LA SALUD DEL PERSONAL DEL PATRONATO	Educación y Bibliotecas		MAS PREVENCIÓN SERVICIO DE PREVENCION, S.L.U.	9893	13/12/2018	Servicios(Menor)
SUSCRIPCION AL DIARIO EL PERIODICO DE ARAGON	Educación y Bibliotecas		PRENSA DIARIA ARAGONESA S.A.	4700	16/11/2018	Suministros(Menor)
Servicio de limpieza de 3 Bibliotecas, Aulario de Universidad Popular y Sede del Patronato Municipal de Educación y Bibliotecas de Zaragoza	Educación y Bibliotecas		EULEN S.A.	43989	30/07/2018	Servicios(Abierto)
MANTENIMIENTO APLICACION DE CONTABILIDAD	Educación y Bibliotecas		IA SOFT ARAGÓN S.L.	3270	20/06/2018	Servicios(Menor)
Formación de personal de las secciones de Escuelas Infantiles y Universidad Popular. (En único lote)	Educación y Bibliotecas		 CONSULTORES M&amp TT, S.L.	10920	28/05/2018	Servicios(Menor)
SUSCRIPCIONES AL PERIODICO HERALDO DE ARAGON	Educación y Bibliotecas		HERALDO DE ARAGÓN EDITORA, S.L.U.	11899	08/05/2018	Suministros(Menor)
Vestuario: ropa de trabajo para el personal de las Escuelas Infantiles Municipales de Zaragoza	Educación y Bibliotecas		EUREDA TEXTIL, S.L.	3300	18/04/2018	Servicios(Menor)
VIGILANCIA DE LA SALUD DEL PERSONAL DEL PATRONATO	Educación y Bibliotecas		MAS PREVENCIÓN SERVICIO DE PREVENCION, S.L.U.	9893	13/12/2018	Servicios(Menor)
SUSCRIPCION AL DIARIO EL PERIODICO DE ARAGON	Educación y Bibliotecas		PRENSA DIARIA ARAGONESA S.A.	4700	16/11/2018	Suministros(Menor)
Servicio de limpieza de 3 Bibliotecas, Aulario de Universidad Popular y Sede del Patronato Municipal de Educación y Bibliotecas de Zaragoza	Educación y Bibliotecas		EULEN S.A.	43989	30/07/2018	Servicios(Abierto)
MANTENIMIENTO APLICACION DE CONTABILIDAD	Educación y Bibliotecas		IA SOFT ARAGÓN S.L.	3270	20/06/2018	Servicios(Menor)
Formación de personal de las secciones de Escuelas Infantiles y Universidad Popular. (En único lote)	Educación y Bibliotecas		 CONSULTORES M&amp TT, S.L.	10920	28/05/2018	Servicios(Menor)
SUSCRIPCIONES AL PERIODICO HERALDO DE ARAGON	Educación y Bibliotecas		HERALDO DE ARAGÓN EDITORA, S.L.U.	11899	08/05/2018	Suministros(Menor)
Vestuario: ropa de trabajo para el personal de las Escuelas Infantiles Municipales de Zaragoza	Educación y Bibliotecas		EUREDA TEXTIL, S.L.	3300	18/04/2018	Servicios(Menor)
SUMINISTRO DE EQUIPAMIENTO INFORMÁTICO PARA AULAS Y SERVICIOS GENERALES DEL INSTITUTO MUNICIPAL DE EMPLEO Y FOMENTO EMPRESARIAL DE ZARAGOZA (ZARAGOZA DINÁMICA)	Zaragoza Dinámica		TEKNOSERVICE	41658	27/12/2018	Suministros(Abierto)
Servicios para desarrollar los proyectos educativos formativos de los centros sociolaborales	Zaragoza Dinámica		FUNDACION ADUNARE	950334	10/07/2018	Servicios(Abierto)
Servicios para desarrollar los proyectos educativos formativos de los centros sociolaborales	Zaragoza Dinámica		FUNDACIÓN SAN VALERO	1360357	10/07/2018	Servicios(Abierto)
Servicios para desarrollar los proyectos educativos formativos de los centros sociolaborales	Zaragoza Dinámica		ASOCIACION TALLER EDUCATIVO LABORAL DE CASETAS	850094	10/07/2018	Servicios(Abierto)
Servicios para desarrollar los proyectos educativos formativos de los centros sociolaborales	Zaragoza Dinámica		FUNDACION ADUNARE	990634	10/07/2018	Servicios(Abierto)
Servicios para desarrollar los proyectos educativos formativos de los centros sociolaborales	Zaragoza Dinámica		FUNDACION ADUNARE	915158	10/07/2018	Servicios(Abierto)
Servicios para desarrollar los proyectos educativos formativos de los centros sociolaborales	Zaragoza Dinámica		FUNDACION ADUNARE	947002	10/07/2018	Servicios(Abierto)
Servicios para desarrollar los proyectos educativos formativos de los centros sociolaborales	Zaragoza Dinámica		FUNDACION ADUNARE	941743	10/07/2018	Servicios(Abierto)
Servicios para desarrollar los proyectos educativos formativos de los centros sociolaborales	Zaragoza Dinámica		FUNDACION PICARRAL	1099957	10/07/2018	Servicios(Abierto)
Servicios para desarrollar los proyectos educativos formativos de los centros sociolaborales	Zaragoza Dinámica		FUNDACION ADUNARE	982431	10/07/2018	Servicios(Abierto)
Servicios para desarrollar los proyectos educativos formativos de los centros sociolaborales	Zaragoza Dinámica		FUNDACION ADUNARE	720086	10/07/2018	Servicios(Abierto)
Servicios para desarrollar los proyectos educativos formativos de los centros sociolaborales	Zaragoza Dinámica		FUNDACIÓN Mª AUXILIADORA	1036736	10/07/2018	Servicios(Abierto)
Servicios para desarrollar los proyectos educativos formativos de los centros sociolaborales	Zaragoza Dinámica		FUNDACION ADUNARE	704280	10/07/2018	Servicios(Abierto)
DISEÑO, DESARROLLO E IMPLEMENTACIÓN DE UN NUEVO PORTAL WEB DE ZARAGOZA TURISMO Y ZARAGOZA CONVENTION BUREAU	Zaragoza Turismo		INNOPULSE	53900	20/12/2018	Servicios(Abierto)
SERVICIO DE PROMOCIÓN Y RECEPTIVO DE ZARAGOZA CONVENTION BUREAU (ZCB) DE ZARAGOZA TURISMO	Zaragoza Turismo		SERVICIOS AUXILIARES ZARAGOZA S.L.	61499	30/11/2018	Servicios(Abierto)
CONTRATACIÓN PARA EL DESARROLLO DE UNA MARCA TURÍSTICA DE ZARAGOZA, ALINEADA A LOS OBJETIVOS DEL PLAN ESTRATÉGICO DE ZARAGOZA TURISMO, ASÍ COMO PARA LA ELABORACIÓN DE UN MANUAL DE IDENTIDAD CORPORATIV	Zaragoza Turismo		OSCAR GARCES OLOZAGARRE (LA MANO Y LA LUNA) 	14144	27/11/2018	Servicios(Menor)
SERVICIO CAMPAÑA PUBLICITARIA DE ZARAGOZA COMO DESTINO EN REVISTA TURISTICA	Zaragoza Turismo		VOCENTO	7000	09/11/2018	Servicios(Menor)
CONTRATACIÓN DE LA PRESTACIÓN DEL SERVICIO DE PLANIFICACIÓN, MEDIACIÓN, CONTRATACIÓN DE ESPACIOS, INSERCIÓN Y POSTERIOR SEGUIMIENTO DE UNA CAMPAÑA DE PUBLICIDAD ONLINE DIRIGIDA A FRANCIA, REINO UNIDO,	Zaragoza Turismo		MEDIATALENT	13140	08/11/2018	Servicios(Menor)
CONTRATACIÓN DE LA PRESTACIÓN DEL SERVICIO DE PLANIFICACIÓN, MEDIACIÓN, CONTRATACIÓN DE ESPACIOS, INSERCIÓN Y POSTERIOR SEGUIMIENTO DE UNA CAMPAÑA DE PUBLICIDAD ONLINE DIRIGIDA A LAS CIUDADES DE SEVIL	Zaragoza Turismo		MEDIATALENT	11475	08/11/2018	Servicios(Menor)
CONTRATACIÓN DE LA PRESTACIÓN DEL SERVICIO DE PLANIFICACIÓN, MEDIACIÓN, CONTRATACIÓN DE ESPACIOS, INSERCIÓN Y POSTERIOR SEGUIMIENTO DE UNA CAMPAÑA DE PUBLICIDAD ONLINE DIRIGIDA A LA COMUNIDAD AUTÓNOMA	Zaragoza Turismo		MEDIATALENT	11685	08/11/2018	Servicios(Menor)
SERVICIO CAMPAÑA CO-MARKETING ONLINE MERCADO BELGA EN ZARAGOZA	Zaragoza Turismo		RYANNAIR DAC	14990	07/11/2018	Servicios(Menor)
"Servicio ""Visitas guiadas de Zaragoza Turismo 2017"""	Zaragoza Turismo		GUÍAS UNIDAS DE ZARAGOZA, UNIÓN TEMPORAL DE EMPRESAS	225340	06/11/2018	Servicios(Abierto)
SERVICO DE PROMOCION Y PUBLICIDAD EN PROGRAMA DE RADIO	Zaragoza Turismo		CADENA SER	6150	06/11/2018	Servicios(Menor)
SERVICIO PUBLICIDAD ZARAGOZA EN REVISTA TURISTICA DIGITAL	Zaragoza Turismo		DISPLAY CONNECTORS S.L.	12000	30/08/2018	Servicios(Menor)
SERVICIO CAMPAÑA PUBLICITARIA ZARAGOZA EN REVISTA EL PAIS SEMANAL	Zaragoza Turismo		EDICIONES EL PAIS S.L.	14800	31/07/2018	Servicios(Menor)
SERVICIO PRESENTACION ZARAGOZA CONGRESOS COMO DESTINO DE EVENTOS	Zaragoza Turismo		ASOC. AGENCIAS VIAJES ESPAÑOLAS ASOCIADAS	5000	23/05/2018	Servicios(Menor)
Prestación de los servicios necesarios en concepto de asistencia técnica a las acciones de investigación y comercialización de Zaragoza Convention Bureau de Zaragoza Turismo.	Zaragoza Turismo		SERVICIOS AUXILIARES ZARAGOZA S.L.	14883	16/05/2018	Servicios(Menor)
SERVICIO DE PROMOCION DE LA MARCA ZARAGOZA IS BIKE 2018	Zaragoza Turismo		tomek	8000	04/05/2018	Servicios(Menor)
SERVICIO DE PROMOCION Y PUBLICIDAD DE LA SEMANA SANTA DE ZARAGOZA EN PROGRAMA DE RADIO	Zaragoza Turismo		CADENA COPE	6000	22/03/2018	Servicios(Menor)
Vinilación de los tres autobuses turísticos utilizados por Zaragoza Turismo	Zaragoza Turismo		De Sola S.L. Servicios gráficos	12000	15/02/2018	Servicios(Menor)
Servicio de seguridad del Palacio de la Real Maestranza de Caballería de Zaragoza, durante el periodo de visitas guiadas 2018	Zaragoza Turismo		ASTRA SISTEMAS S.A. 	7600	23/01/2018	Servicios(Menor)
Prestación de los servicios necesarios en concepto de asistencia técnica a las acciones de promoción y receptivo de Zaragoza Convention Bureau de Zaragoza Turismo.	Zaragoza Turismo		SERVICIOS AUXILIARES ZARAGOZA S.L.	17873	22/01/2018	Servicios(Menor)
Contrato para la concesión a la ciudad de Zaragoza de la Capitalidad del Baloncesto Español - Capital Española del Baloncesto 2019,	Zaragoza Deporte		FEDERACIÓN ESPAÑOLA DE BALONCESTO	50000	29/11/2018	Privado(Negociado sin publicidad)
Contrato para la celebración de la Concentración de la Selección Nacional Masculina Sub 20 de Rugby y de un encuentro amistoso con la Selección Nacional de Rumanía del 2 al 9 de diciembre de 2018	Zaragoza Deporte		FEDERACIÓN ESPAÑOLA DE RUGBY	33057	29/11/2018	Privado(Negociado sin publicidad)
Contrato de alquiler de las instalaciones y servicios del Pabellón Príncipe Felipe de Zaragoza para la celebración del concierto YO TAMBIÉN FUI A EGB, el día 15 de diciembre de 2018	Zaragoza Deporte		2M GROUP EVENTOS, S.L. 	10200	26/11/2018	Servicios(Menor)
Contrato de alquiler de las instalaciones y servicios del Pabellón Príncipe Felipe de Zaragoza para la celebración del XLIV Concurso de Exaltación de Instrumentos Tradicionales de la Semana Santa de Zaragoza, los días 6 y 7 de abril de 2019	Zaragoza Deporte		JUNTA COORDINADORA DE COFRADÍAS DE SEMANA SANTA DE ZARAGOZA 	4680	09/11/2018	Servicios(Menor)
Contrato de alquiler de las instalaciones y servicios del Pabellón Príncipe Felipe de Zaragoza para la celebración del concierto de LOQUILLO Rock and Roll Actitud 2018, el día 1 de diciembre de 2018	Zaragoza Deporte		Riff Producciones, S.L. - ES	4850	07/11/2018	Servicios(Menor)
Contrato de alquiler de las instalaciones y servicios del Pabellón Príncipe Felipe de Zaragoza para la celebración del concierto de MALÚ Oxígeno Tour, el día 24 de noviembre de 2018	Zaragoza Deporte		Riff Producciones, S.L. - ES	5150	15/10/2018	Servicios(Menor)
Contrato de alquiler de las instalaciones y servicios del Pabellón Príncipe Felipe de Zaragoza para la celebración del espectáculo LA VIDA MODERNA, el día 14 de diciembre de 2018	Zaragoza Deporte		MANAGEMENT I PRODUCCIONS CULTURALS, S.L. 	13370	10/10/2018	Servicios(Menor)
Contrato de alquiler de las instalaciones y servicios del Pabellón Príncipe Felipe de Zaragoza para la celebración del concierto LOVE THE 90`S el día 6 de octubre de 2018	Zaragoza Deporte		Eventos MPH Directo, S.L. - ES	15020	05/10/2018	Servicios(Otros)
Contrato de alquiler de las instalaciones y servicios del Pabellón Príncipe Felipe de Zaragoza para la celebración del concierto de MANOLO GARCÍA Geometría del Rayo, el día 13 de octubre de 2018	Zaragoza Deporte		Eventos MPH Directo, S.L. - ES	7300	20/09/2018	Servicios(Menor)
Contrato de alquiler de las instalaciones y servicios del Pabellón Príncipe Felipe de Zaragoza para la celebración del espectáculo  DISNEY ON ICE Conquista tus sueños los días 7 8 9 y 10 de marzo de 2019	Zaragoza Deporte		PROACTIV, S,L.	25585	20/09/2018	Servicios(Otros)
Contrato de alquiler de las instalaciones y servicios del Pabellón Príncipe Felipe de Zaragoza para la celebración del espectáculo de FREESTYLE, el día 17 de noviembre de 2018	Zaragoza Deporte		DURGA MISSION, S.L. 	4450	10/09/2018	Servicios(Menor)
Contrato de alquiler de las instalaciones y servicios del Pabellón Príncipe Felipe de Zaragoza para la celebración del concierto de DANI MARTÍN Grandes éxitos y pequeños desastres, el día 11 de octubre de 2018	Zaragoza Deporte		Borina Producciones, s.l. - ES	7600	04/09/2018	Servicios(Menor)
