actividad	centro	dni	quien	importe	date	tipo
Acuerdo marco de suministro de vestuario para el personal municipal, (suministro vestuario para el personal municipal 2018), Lotes: 1, 4, 6, 7, 8, 9, 12, 13, 15,17, 18, 19, 20, 21, 22, 23 y 24	Ayuntamiento		EL CORTE INGLÉS, S.A.	5576	31/12/2018	Suministros(Basado en Acuerdo Marco)
Acuerdo marco de suministro de vestuario para el personal municipal, (suministro vestuario para el personal municipal 2018), Lotes: 1, 4, 6, 7, 8, 9, 12, 13, 15,17, 18, 19, 20, 21, 22, 23 y 24	Ayuntamiento		EL CORTE INGLÉS, S.A.	34938	31/12/2018	Suministros(Basado en Acuerdo Marco)
Acuerdo marco de suministro de vestuario para el personal municipal, (suministro vestuario para el personal municipal 2018), Lotes: 1, 4, 6, 7, 8, 9, 12, 13, 15,17, 18, 19, 20, 21, 22, 23 y 24	Ayuntamiento		EL CORTE INGLÉS, S.A.	3072	31/12/2018	Suministros(Basado en Acuerdo Marco)
Acuerdo marco de suministro de vestuario para el personal municipal, (suministro vestuario para el personal municipal 2018), Lotes: 1, 4, 6, 7, 8, 9, 12, 13, 15,17, 18, 19, 20, 21, 22, 23 y 24	Ayuntamiento		SEPI- PRODISSER S.L	12077	31/12/2018	Suministros(Basado en Acuerdo Marco)
Acuerdo marco de suministro de vestuario para el personal municipal, (suministro vestuario para el personal municipal 2018), Lotes: 1, 4, 6, 7, 8, 9, 12, 13, 15,17, 18, 19, 20, 21, 22, 23 y 24	Ayuntamiento		SAGRES, S.L	7519	31/12/2018	Suministros(Basado en Acuerdo Marco)
Acuerdo marco de suministro de vestuario para el personal municipal, (suministro vestuario para el personal municipal 2018), Lotes: 1, 4, 6, 7, 8, 9, 12, 13, 15,17, 18, 19, 20, 21, 22, 23 y 24	Ayuntamiento		EL CORTE INGLÉS, S.A.	40852	31/12/2018	Suministros(Basado en Acuerdo Marco)
Acuerdo marco de suministro de vestuario para el personal municipal, (suministro vestuario para el personal municipal 2018), Lotes: 1, 4, 6, 7, 8, 9, 12, 13, 15,17, 18, 19, 20, 21, 22, 23 y 24	Ayuntamiento		EL CORTE INGLÉS, S.A.	5887	31/12/2018	Suministros(Basado en Acuerdo Marco)
Acuerdo marco de suministro de vestuario para el personal municipal, (suministro vestuario para el personal municipal 2018), Lotes: 1, 4, 6, 7, 8, 9, 12, 13, 15,17, 18, 19, 20, 21, 22, 23 y 24	Ayuntamiento		SEPI- PRODISSER S.L	8323	31/12/2018	Suministros(Basado en Acuerdo Marco)
Acuerdo marco de suministro de vestuario para el personal municipal, (suministro vestuario para el personal municipal 2018), Lotes: 1, 4, 6, 7, 8, 9, 12, 13, 15,17, 18, 19, 20, 21, 22, 23 y 24	Ayuntamiento		EL CORTE INGLÉS, S.A.	57184	31/12/2018	Suministros(Basado en Acuerdo Marco)
Acuerdo marco de suministro de vestuario para el personal municipal, (suministro vestuario para el personal municipal 2018), Lotes: 1, 4, 6, 7, 8, 9, 12, 13, 15,17, 18, 19, 20, 21, 22, 23 y 24	Ayuntamiento		EL CORTE INGLÉS, S.A.	34330	31/12/2018	Suministros(Basado en Acuerdo Marco)
Acuerdo marco de suministro de vestuario para el personal municipal, (suministro vestuario para el personal municipal 2018), Lotes: 1, 4, 6, 7, 8, 9, 12, 13, 15,17, 18, 19, 20, 21, 22, 23 y 24	Ayuntamiento		SEPI- PRODISSER S.L	36417	31/12/2018	Suministros(Basado en Acuerdo Marco)
"Contrato derivado del ""Acuerdo marco para el suministro de mobiliario de oficina con destino al Ayuntamiento de Zaragoza (lotes 2 y 3)"""	Ayuntamiento		OFITA INTERIORES S.A.	26127	28/12/2018	Suministros(Abierto)
SUMINISTRO Y RENOVACIÓN DE EQUIPAMIENTO INFORMATICO DE PUESTO.	Ayuntamiento		OMEGA PERIPHERALS S.L	3280	27/12/2018	Servicios(Abierto)
"Contrato derivado del ""acuerdo marco para el suministro de mobiliario de oficina con destino al Ayuntamiento de Zaragoza (Lotes 2 y 3)"""	Ayuntamiento		OFITA INTERIORES S.A.	5364	27/12/2018	Suministros(Basado en Acuerdo Marco)
SUMINISTRO Y RENOVACIÓN DE EQUIPAMIENTO INFORMATICO DE PUESTO.	Ayuntamiento		OMEGA PERIPHERALS S.L	11804	27/12/2018	Servicios(Abierto)
"Contrato derivado del ""acuerdo marco para el suministro de mobiliario de oficina con destino al Ayuntamiento de Zaragoza (Lotes 2 y 3)"""	Ayuntamiento		MULTIESTILO S.L.	3249	27/12/2018	Suministros(Basado en Acuerdo Marco)
"Contrato derivado del ""Acuerdo marco para el suministro de mobiliario de oficina con destino al Ayuntamiento de Zaragoza (lotes 2 y 3)"""	Ayuntamiento		MULTIESTILO S.L.	10965	27/12/2018	Suministros(Abierto)
SUMINISTRO Y RENOVACIÓN DE EQUIPAMIENTO INFORMATICO DE PUESTO.	Ayuntamiento		TEKNOSERVICE	135000	26/12/2018	Servicios(Abierto)
SUMINISTRO Y RENOVACIÓN DE EQUIPAMIENTO INFORMATICO DE PUESTO.	Ayuntamiento		TEKNOSERVICE	23000	26/12/2018	Servicios(Abierto)
Servicio de recogida, transporte y manipulación de la recaudación de las dependencias municipales de caja.	Ayuntamiento		LOOMIS SPAIN S.A	120519	26/12/2018	Servicios(Abierto)
CLASES DE ESPAÑOL EN VERANO PARA PERSONAS INMIGRANTES	Ayuntamiento		EDUC INTEG MOSAICO	30800	26/12/2018	Servicios(Abierto)
MODIFICACION DE SOFTWARE GESTION ALMACEN VESTUARIO	Ayuntamiento		ALERCE INFORMATICA APLICADA S.A.	11116	24/12/2018	Servicios(Menor)
OBRAS DE REP. Y ELIMINACION DE CHIMENEA EN ESCALERA DE LA ANTIGUA PORTERIA EN LA CARTUJA BAJA	Ayuntamiento		CONSTRUCCIONES AMADO TERRÉN, S.L	21495	21/12/2018	Obras(Menor)
SUMINISTRO Y RENOVACIÓN DE EQUIPAMIENTO INFORMATICO DE PUESTO.	Ayuntamiento		GRUPO SOLITIUM S.L	37995	21/12/2018	Servicios(Abierto)
REMODELACION EDIFICIO ALCALDIA EN BARRIO TORRECILLA DE VALMADRID. ZARAGOZA.(Convenio DPZ 17-19)	Ayuntamiento		APB OBRAS Y CONTRUCCIONES, SL	22727	21/12/2018	Obras(Menor)
Carril de bicicletas en Avda. Estudiantes	Ayuntamiento		CONSTRUCCIONES IBERCO, S.A.	39486	20/12/2018	Obras(Menor)
ADQUISICION DE BOXES PORTATILES PARA PERROS CON FINALIDAD DE CUARENTENA	Ayuntamiento		MANUEL VELEZ-BRACHO NARANJO	14883	20/12/2018	Suministros(Menor)
Analisis estrategico integral de la gestion y control de la contaminacion acustica en  Zaragoza	Ayuntamiento		UNIVERSIDAD DE ZARAGOZA	14875	20/12/2018	Servicios(Menor)
SUMINISTRO E INSTALACION DE GIMNASIO EN LA CALLE EN PARQUE PIGNATELLI	Ayuntamiento		AGAPITO URBAN INDUSTRIES, S.L.	9729	19/12/2018	Suministros(Menor)
SUMINISTRO DE BANCOS EN EL PARKING SUR DE LA EXPO RASTRO	Ayuntamiento		PARQUES Y JARDINES FABREGAS S.A	14998	19/12/2018	Servicios(Menor)
SERVICIO DE LAVADO Y PLANCHADO ROPA DE TRABAJO POR EMPRESA DE INSERCIÓN LABORAL, MEDIANTE PROCEDIMIENTO ABIERTO SIMPLIFICADO Y ABREVIADO	Ayuntamiento		FADE INTEGRA, S.L.	9721	18/12/2018	Servicios(Abierto Simplificado)
SUMINISTRO E INSTALACION DE PARQUE DE MAYORES EN JARDINES JESUS GRACIA	Ayuntamiento		AGAPITO URBAN INDUSTRIES, S.L.	13012	17/12/2018	Suministros(Menor)
PRESTACION DEL SERVICIO DE ANALISIS CLINICOS PARA EL PERSONAL MUNICIPAL	Ayuntamiento		Eurofins Megalab, SAU	10897	17/12/2018	Servicios(Menor)
ADQUISICIÓN Y SUMINISTRO DE DOS CINEMÓMETROS LÁSER PORTÁTILES, CON DESTINO A LA POLICÍA LOCAL DE ZARAGOZA.	Ayuntamiento		TRADESEGUR S.A	27150	17/12/2018	Suministros(Abierto)
BASE DE DATOS ARANZADI VISION (2018-2019)	Ayuntamiento		EDITORIAL-ARANZADI-SA	3316	17/12/2018	Servicios(Menor)
AMPLIACION INSTALACION FOTOVOLTAICA AUTOCONSUMO DE 25 KW EN PDM SIGLO XXI	Ayuntamiento		SOLARFAM INGENIERIA SL	26109	17/12/2018	Obras(Menor)
"ADQUISICIÓN DE 78 EQUIPOS DE RADIOTRANSMISORES PORTÁTILES SISTEMA ""TETRA"", BATERÍAS, ANTENAS DE LOS MISMOS, CARGADORES, FUNDAS Y 37 MICROAURICULARES, CON DESTINO A LA POLICÍA LOCAL DE ZARAGOZA"	Ayuntamiento		ZENON DIGITAL RADIO S.L.	48400	17/12/2018	Suministros(Abierto Simplificado)
Rampa de acceso al anfiteatro del Parque de Delicias	Ayuntamiento		ARAGONESA DE CONTRATAS S.L	21700	17/12/2018	Obras(Menor)
Adquisicion equipos de sistema de alimentacion ininterrumpido SAI	Ayuntamiento		SISTEMAS TECNOLÓGICOS AVANZADOS	8200	14/12/2018	Suministros(Menor)
RENOVACION DE ASFALTO EN C/MAYOR DEL Bº LA CARTUJA BAJA ( PRESUPUESTOS PARTICIPATIVOS 2018)	Ayuntamiento		ARAGONESA DE CONTRATAS S.L	15500	13/12/2018	Obras(Menor)
INSTALACION DE ESCALERAS EN EL CEMENTERIO DE CASETAS. ( PRESUPUESTOS PARTICIPATIVOS 2018)	Ayuntamiento		MASENA,S.L.	7401	13/12/2018	Suministros(Menor)
SUPRESION DE BARRERAS ARQUITECTONICAS EN EL BARRIO DE MOVER( PRESUPUESTOS PARTICIPATIVOS BB.RR)	Ayuntamiento		ARAGONESA DE CONTRATAS S.L	15800	13/12/2018	Obras(Menor)
SUSTITUCION DE CARPINTERIA EN ANTIGUASESCUELAS DEL LUGARICO DE CERDAN.PRES.PART.2018	Ayuntamiento		APB OBRAS Y CONTRUCCIONES, SL	10330	13/12/2018	Suministros(Menor)
P.P. SUMINISTRO E INSTALACION DEL SISTEMA DE MEGAFONIA EN CENTRO CIVICO TIO JORGE	Ayuntamiento		INDUSTRIA Y MONTAJES ELÉCTRICOS S.A.	9566	13/12/2018	Suministros(Menor)
MEGAFONIA EXTERIOR BARRIO DE MONZALBARBA.PRESUPUESTOS PARTICIPATIVOS 2018	Ayuntamiento		INDUSTRIA Y MONTAJES ELÉCTRICOS S.A.	9537	13/12/2018	Suministros(Menor)
ADQUISICION DE MATERIAL DE ILUMINACION PARA ZARAGOZA ACTIVA	Ayuntamiento		AUDIO IMPORT PROFESIONAL S.L.	10743	12/12/2018	Suministros(Menor)
Adquisicion por sustitucion de una lavadora de mascaras equipos respiratorios.	Ayuntamiento		DRAGER IBERIA	6250	12/12/2018	Suministros(Menor)
Servicio de adaptacion de los procesos de indexacion de la sede electronica	Ayuntamiento		HIBERUS TECNOLOGÍAS DE LA INFORMACIÓN S.L.	11980	12/12/2018	Servicios(Menor)
EQUIPAMIENTO DE AUTOFABRICACION, AUTOEDICION Y REALIDAD VIRTUAL PARA ZARAGOZA ACTIVA	Ayuntamiento		GRUPO SOLITIUM S.L	14900	12/12/2018	Suministros(Menor)
CONSTRUCCION DE JARDINERAS-BANCO DE GAVIONES COMO ELEMENTO MOBILIARIO URBANO, EN PARKING SUR EXPO	Ayuntamiento		EXCAVACIONES GRASA S.L	37744	12/12/2018	Obras(Menor)
Obras de acceso al Parque Tio Jorge por c/ Sixto Celorrio	Ayuntamiento		ÁRIDOS Y EXCAVACIONES CARMELO LOBERA, S.L. 	32940	12/12/2018	Obras(Menor)
ILUMINACION INSTALACION DEPORTIVA ELEMENTAL PARQUE LA GRANJA (18-062)	Ayuntamiento		INDUSTRIA Y MONTAJES ELÉCTRICOS S.A.	18458	12/12/2018	Obras(Menor)
Adquisicion 10 Equipos de Proteccion Respiratoria.	Ayuntamiento		DRAGER IBERIA	14668	12/12/2018	Suministros(Menor)
CONTRATO MENOR PARA SUMINISTRO DE ESCENARIO MODULAR DESMONTABLE CON DESTINO AL DISTRITO SUR	Ayuntamiento		MILLAN PRO SERVICIOS PROFESIONALES, S.L.	14780	12/12/2018	Suministros(Menor)
CUBRICION DE ALCORQUES EN DISTRITO UNIVERSIDAD	Ayuntamiento		JARA JARDINERIA, OBRAS Y SERVICIOS SL	23000	10/12/2018	Obras(Menor)
SUMINISTRO E INSTALACION DE APARATOS DE GIMNASIA PARA MAYORES EN PLAZA SAN FRANCISCO	Ayuntamiento		AGAPITO URBAN INDUSTRIES, S.L.	6690	10/12/2018	Suministros(Menor)
SUMINISTRO E INSTALACION DE GIMNASIO EN LA CALLE EN PARQUE GLORIETAS DE GOYA	Ayuntamiento		AGAPITO URBAN INDUSTRIES, S.L.	8332	10/12/2018	Suministros(Menor)
SUMINISTRO DE PAPELERA DE  EXTERIOR PARA REPOSICION EN BARRIO DE CASETAS	Ayuntamiento		CONTENUR S.L	12396	10/12/2018	Suministros(Menor)
SUMINISTRO E INSTALACION DE PARQUE DE MAYORES EN PARQUE TIO JORGE	Ayuntamiento		AGAPITO URBAN INDUSTRIES, S.L.	13401	05/12/2018	Suministros(Menor)
Mejora del Parque de Miraflores, embaldosado de caminos y arreglo de pavimentos.	Ayuntamiento		ÁRIDOS Y EXCAVACIONES CARMELO LOBERA, S.L. 	36500	05/12/2018	Obras(Menor)
Sustitucion de Verja Metalica y Repaso de Muro en el Parque del Tio Jorge	Ayuntamiento		ÁRIDOS Y EXCAVACIONES CARMELO LOBERA, S.L. 	17900	05/12/2018	Obras(Menor)
SUMINISTRO DE ARMAMENTO CON DESTINO A LA POLICÍA LOCAL DE ZARAGOZA POR PROCEDIMIENTO ABIERTO, SIMPLIFICADO Y ABREVIADO.	Ayuntamiento		ARMERÍA MARCOS S.C.A.	16384	05/12/2018	Suministros(Abierto Simplificado)
Suministro de tres analizadores en continuo de cloro libre mediante amperometria	Ayuntamiento		MATELCO	14190	04/12/2018	Suministros(Menor)
Suministro bordillo y baldosa hidraulica.	Ayuntamiento		MOSAICOS-PRIETO-SL	3948	04/12/2018	Suministros(Menor)
SUMINISTRO DESFIBRILADORES EQUIPAMIENTO BARRIO SANTA ISABEL ( PRESUPUESTOS PARTICIPATIVOS 2018)	Ayuntamiento		ASOC . CUIDAE	4317	04/12/2018	Suministros(Menor)
CONSTRUCCIÓN DE 1050 COLUMBARIOS 2018-MANZANAS 109, 110, 120, A-4	Ayuntamiento		GLOBAL-CONSTRUCCION-E-INFRAESTRUCTURA S.L.	198630	04/12/2018	Obras(Abierto Simplificado)
Reposicion Equipos de comunicacion manos libres para uso de equipos portatiles de radio.	Ayuntamiento		CEOTRONICS S.L	14560	03/12/2018	Suministros(Menor)
Obras de ejecucion de pista de patinaje en solar sito en Aldebaran con Orion	Ayuntamiento		ÁRIDOS Y EXCAVACIONES CARMELO LOBERA, S.L. 	26900	03/12/2018	Obras(Menor)
NUEVO CENTRO CÍVICO ROSALES DEL CANAL	Ayuntamiento		PROFORMA EJECUCIÓN DE OBRAS Y RESTAURACIONES, S.L.	1046287	03/12/2018	Obras(Abierto)
Suministro de combustibles con destino a edificios y otros equipamientos del Ayuntamiento de Zaragoza	Ayuntamiento		ESERGUI DISTESER S.L.	3305785	30/11/2018	Suministros(Abierto)
ADQUISICION DE EQUIPO ANALIZADOR DE OZONO	Ayuntamiento		SISTEMAS TECNOLÓGICOS AVANZADOS	14700	30/11/2018	Suministros(Menor)
Suministro de material audiovisual en la  Casa Consistorial del Ayuntamiento de Zaragoza	Ayuntamiento		ALBERTO CASAMIAN GUERRERO	8863	29/11/2018	Suministros(Menor)
Adquisicion de 2 Monitores de agua portatil de suelo.	Ayuntamiento		AXATON, S.L	9385	28/11/2018	Suministros(Menor)
Adquisicion 2 juegos de cojines elevacion neumatica.	Ayuntamiento		INDUSTRIAL GLOBAL SUPPLY S.L. 	9519	28/11/2018	Suministros(Menor)
Obras para plantacion de arboles y colocacion de bancos en Lucien Briet prop. municipal	Ayuntamiento		CONSOLIDA OLIVER S.L.	9484	28/11/2018	Obras(Menor)
Adquisicion 2 herramientas hidraulicas de rescate con tecnologia de acoplamiento coaxial plano.	Ayuntamiento		INCIPRESA	9081	28/11/2018	Suministros(Menor)
Adquisicion de 1 camara termica y accesorios	Ayuntamiento		DRAGER IBERIA	8875	28/11/2018	Suministros(Menor)
SUMINISTRO DE 8 VEHÍCULOS DEL SERVICIO CONTRA INCENDIOS, DE SALVAMENTO Y PROTECCIÓN CIVIL	Ayuntamiento		CARZA, S.A.	23956	27/11/2018	Suministros(Abierto)
SUMINISTRO DE EQUIPOS DE FILTRACION PARA PISCINAS	Ayuntamiento		PRODUCTOS QUIMICOS, S.L.	6548	27/11/2018	Suministros(Menor)
SUMINISTRO DE 8 VEHÍCULOS DEL SERVICIO CONTRA INCENDIOS, DE SALVAMENTO Y PROTECCIÓN CIVIL	Ayuntamiento		AGREDA AUTOMOVIL S.A.	49300	27/11/2018	Suministros(Abierto)
Asistencia_Tecnica_NDMP	Ayuntamiento		OMEGA PERIPHERALS	5500	23/11/2018	Servicios(Menor)
FORMACION NETAPP	Ayuntamiento		PROSOL	9642	23/11/2018	Servicios(Menor)
Martillos hidraulicos retroexcavadora.Bajo nivel sonoro dBA	Ayuntamiento		J.R.A-MAQUINARIA-SL	12300	23/11/2018	Suministros(Menor)
Suministro Licencias Soporte Fortiwifi	Ayuntamiento		SAYTEL SERVICIOS INFORMATICOS, S.A.	8656	23/11/2018	Suministros(Menor)
MANTENIMIENTO Y ACTUALIZACIÓN DEL APLICATIVO INFORMÁTICO DE TRAMITACIÓN DE LOS EXPEDIENTES Y ACTUACIONES RELATIVAS A LA CONTRATACIÓN DEL AYUNTAMIENTO DE ZARAGOZA	Ayuntamiento		EUROFOR CENTRO DE FORMACIÓN S.L.	23140	23/11/2018	Servicios(Abierto Simplificado)
AUDITORIA CPD AYUNTAMIENTO. ZARAGOZA	Ayuntamiento		AQUADS TECHNOLOGIES	6200	23/11/2018	Servicios(Menor)
Suministro Cortafuegos para Sedes Remotas Municipales	Ayuntamiento		SAYTEL INFORMATICA, S.L.	13810	23/11/2018	Suministros(Menor)
ESTUDIO DE MERCADO DE HABITOS DE CONSUMO Y ACEPTACION DE PRODUCTOS ECOLOGICOS Y DE PROXIMIDAD	Ayuntamiento		SIGMADOS ANALISIS E INVESTIGACION S.L.	10500	22/11/2018	Servicios(Menor)
Diseno e Implementacion del Serv. de Visualizacion de Informacion ref. a la Movilidad Urbana	Ayuntamiento		GEOSPATIUMLAB S.L.	12500	22/11/2018	Servicios(Menor)
ACONDICIONAMIENTO DE CAMINOS MUNICIPALES EN LOS BARRIOS DE  PENAFLOR Y MONTANANA ( ZONA NORESTE)	Ayuntamiento		ÁRIDOS Y EXCAVACIONES CARMELO LOBERA, S.L. 	11590	22/11/2018	Obras(Menor)
ACONDICIONAMIENTO DE CAMINOS MUNICIPALESEN LOS BARRIOS DE JUSLIBOL Y SAN GREGORIO(ZONA NORTE	Ayuntamiento		ÁRIDOS Y EXCAVACIONES CARMELO LOBERA, S.L. 	26350	22/11/2018	Obras(Menor)
SUMINISTRO DE MONITORES INALAMBRICOS DE 4 GASES PARA EL SERVICIO DE INSTALACIONES DEPORTIVAS	Ayuntamiento		IBERSYSTEM, S.A	13133	22/11/2018	Suministros(Menor)
TRONZADORAS PARA  CORTE DE TUBERIAS DE  FUNDICION CON FRENO DE DISCO DE PARE RAPIDO	Ayuntamiento		OVIDIO-RIN-SA	7840	22/11/2018	Suministros(Menor)
Suministro Equipos Videovigilancia Seminario	Ayuntamiento		PROYECTOS ESTUDIOS Y PRESUPUESTOS S.L.	14619	22/11/2018	Suministros(Menor)
OBRAS DE ACONDICIONAMIENTO DE FACHADA EN TEATRO PRINCIPAL	Ayuntamiento		IMESAPI S.A.	36511	20/11/2018	Obras(Menor)
Suministro de equipos multifuncionales, en régimen de alquiler (26 equipos multifuncionales con fax del lote A, 5 equipos multifuncionales con fax del lote B)”	Ayuntamiento		CANON ESPAÑA, S.A	74821	20/11/2018	Suministros(Basado en Acuerdo Marco)
Acuerdo marco para el suministro de mobiliario de oficina con destino al Ayuntamiento de Zaragoza (lotes 2 y 3)	Ayuntamiento		MULTIESTILO S.L.	42304	20/11/2018	Suministros(Basado en Acuerdo Marco)
Acuerdo marco para el suministro de mobiliario de oficina con destino al Ayuntamiento de Zaragoza (lotes 2 y 3)	Ayuntamiento		OFITA INTERIORES S.A.	24427	20/11/2018	Suministros(Basado en Acuerdo Marco)
ACONDICIONAMIENTO DE CAMINOS MUNICIPALES EN  GARRAPINILLOS YVENTA DEL OLIVAR (ZONA OESTE )	Ayuntamiento		ÁRIDOS Y EXCAVACIONES CARMELO LOBERA, S.L. 	26350	20/11/2018	Obras(Menor)
*ACONDICIONAMIENTO DE CAMINOS MUNICIPALESEN EL BARRIO DE MOVERA(zoNA ESTE)	Ayuntamiento		ÁRIDOS Y EXCAVACIONES CARMELO LOBERA, S.L. 	19740	20/11/2018	Obras(Menor)
RESTAURACION DE LOS ARTESONADOS DEL PALACIO DE AYERBE	Ayuntamiento		el barco	16200	20/11/2018	Obras(Menor)
ADQUISICION SISTEMA LIMS PARA LA GESTION DE LABORATORIO DEL INSTITUTO MUNICIPAL DE SALUD PUBLICA.	Ayuntamiento		INSTRUMENTACION Y COMPONENTES	14950	19/11/2018	Suministros(Menor)
ADQUISICION ORDENADORES PORTATILES	Ayuntamiento		CLD INFORMATICA	8552	19/11/2018	Suministros(Menor)
SUMINISTRO EQUIPOS BSR INFRAESTRUCTURA TETRA	Ayuntamiento		TELTRONIC SAU	14938	16/11/2018	Suministros(Menor)
 Obtención de cartografía a escala 1/500 mediante restitución fotogramétrica 	Ayuntamiento		GESTIÓN Y SERVICIOS FOTOGRAMÉTRICOS, S.L.	19669	15/11/2018	Servicios(Abierto Simplificado)
MEJORA DE LA EFICIENCIA ENERGETICA Y CONFORT CLIMATIZACION BIBLIOTECA DEL C.C. DE GARRAPINILLOS	Ayuntamiento		TUBEI-SL	39990	14/11/2018	Obras(Menor)
Cambio caldera para mejora de la eficiencia energetica en la residencia municipal  Casa de Amparo.	Ayuntamiento		ECHEMAN S.A.	29469	14/11/2018	Obras(Menor)
ADQUISICION PLOTER ESCANER	Ayuntamiento		RICOH-ESPANA-SLU	7925	14/11/2018	Suministros(Menor)
 Suministro de un equipo analizador de carbono orgánico total (TOC) y nitrógeno total en muestras ambientales. 	Ayuntamiento		IZASA SCIENTIFIC S.L.U.	27850	13/11/2018	Suministros(Abierto Simplificado)
Acondicionamiento terreno Ps. de los Platanos CRT para uso publico (Presupuestos Participativos)	Ayuntamiento		CESAR AUGUSTA 2020 S.L.	9445	12/11/2018	Obras(Menor)
Adecuacion de solares para aparcamiento en Almadieros del Roncal y Selva de Oza	Ayuntamiento		CESAR AUGUSTA 2020 S.L.	28330	12/11/2018	Obras(Menor)
PARA LA RENOVACION PARCIAL DE SISTEMA DE VIDEO	Ayuntamiento		AUDIO IMPORT PROFESIONAL S.L.	10525	12/11/2018	Suministros(Menor)
MODIFICACION DE PUNTO DE SUMINISTRO DE ENERGIA EN CALLE EMBARCADERO Nº 4 (18-066)	Ayuntamiento		ENRIQUE COCA, S.A.	6451	09/11/2018	Obras(Menor)
SUMINISTRO DE MATERIALES, ALQUILER DE MAQUINARIA DE MOVIMIENTO DE TIERRAS, CON CONDUCTOR Y OTROS MEDIOS PARA EL MANTENIMIENTO Y REPARACIÓN DE LOA CAMINOS MUNICIPALES NO ASFALTADOS	Ayuntamiento		ÁRIDOS Y EXCAVACIONES CARMELO LOBERA, S.L. 	10299	09/11/2018	Suministros(Abierto)
SUMINISTRO DE MATERIALES, ALQUILER DE MAQUINARIA DE MOVIMIENTO DE TIERRAS, CON CONDUCTOR Y OTROS MEDIOS PARA EL MANTENIMIENTO Y REPARACIÓN DE LOA CAMINOS MUNICIPALES NO ASFALTADOS	Ayuntamiento		EXCAVACIONES GRASA S.L	11404	09/11/2018	Suministros(Abierto)
Adquisición y suministro de diez vehículos turismo híbridos con destino a la Policía Local de Zaragoza. 	Ayuntamiento		ARTAL VEHÍCULOS ZARAGOZA S.L.,	189256	09/11/2018	Suministros(Abierto)
SUMINISTRO DE MATERIALES, ALQUILER DE MAQUINARIA DE MOVIMIENTO DE TIERRAS, CON CONDUCTOR Y OTROS MEDIOS PARA EL MANTENIMIENTO Y REPARACIÓN DE LOA CAMINOS MUNICIPALES NO ASFALTADOS	Ayuntamiento		EXCAVACIONES GRASA S.L	11404	09/11/2018	Suministros(Abierto)
Adecuacion de solar para uso publico deportivo en Cn. Juslibol, 61	Ayuntamiento		AGAPITO URBAN INDUSTRIES, S.L.	15431	08/11/2018	Obras(Menor)
RENOVACION DE BICICLETAS Y CICLOS DE TRES RUEDAS CON DESTINO A EL PARQUE INFANTIL DE TRAF. DE LA PLZ	Ayuntamiento		CICLOS ARAGON S.A.	4759	08/11/2018	Suministros(Menor)
Acondicionamiento de una parte del solar sito en Juan Bautista Labana con uso publico y deportivo	Ayuntamiento		ÁRIDOS Y EXCAVACIONES CARMELO LOBERA, S.L. 	28900	08/11/2018	Obras(Menor)
Suministro de mortero y cemento, para trabajos de las Brigadas de Conservacion de Infraestructura	Ayuntamiento		MATERIALES DE CONSTRUCCION ESPORRIN SL	3354	07/11/2018	Suministros(Menor)
Suministro Puntos Acceso Inalambrico Centro Civicos	Ayuntamiento		SAYTEL SOLUCIONES GLOBALES, S.L.	14463	06/11/2018	Suministros(Menor)
DIAGNOSTICO DE SITUACION Y PROPUESTA ACTUACION GESTION INTEGRAL PLAGAS EN EL MUNICIPIO DE ZARAGOZA	Ayuntamiento		QUIMERA BIOLOGICAL SYSTEMS S.L.	12735	06/11/2018	Suministros(Menor)
Suministro de medidor multiparametrico para el control del agua suministrada con camiones cisterna.	Ayuntamiento		HACH LANGE SPAIN, S.L.U.	3741	05/11/2018	Suministros(Menor)
Suministro EPIS en reparacion tuberias de  fibrocemento.	Ayuntamiento		SERVICIOS AUXILIARES LOGISTICA FERRETERIA S.L.U.	2886	05/11/2018	Suministros(Menor)
Contrato Menor Servicios realizacion perforaciones de drenaje en Sepulturas Cementerio  de Torrero.	Ayuntamiento		LABORATORIO DE ENSAYOS TECNICOS S.A	8016	30/10/2018	Servicios(Menor)
MEMORIA VALORADA OBRAS DE MEJORA DE LA SALA VENECIA	Ayuntamiento		APLICACIONES Y DESARROLLOS INTEGRALES MARCO, S.L.	12897	30/10/2018	Obras(Menor)
SUMINISTRO DE PISTA DESMONTABLE A3 PARA REPOSICION PARCIAL DE LA YA EXISTENTE EN EL CDM SIGLO XXI	Ayuntamiento		PL Sports, S.L.	14980	29/10/2018	Suministros(Menor)
ACONDICIONAMIENTO DE ACCESOS Y DESLINDE DE PARCELAS EN EL PARQUE AGROECOLOGICO VIVERO DE MOVERA	Ayuntamiento		PLANTAE ARAGON S.L.	24700	26/10/2018	Obras(Menor)
RESTAURACION DE 4 LOTES DE MONEDAS PROCEDENTES DE EXCAVACIONES ARQUEOLOGICAS MUNICIPALES EN ZARAGOZA	Ayuntamiento		BALDER SERVICIOS PROFESIONALES, S.L.	14200	26/10/2018	Servicios(Menor)
OBRAS DE ACONDICIONAMIENTO DE LA RECEPCION DE LA BIBLIOTECA MARIA MOLINER	Ayuntamiento		PUBLIC SERVICE ENTERPRISE, S.L.	36825	25/10/2018	Obras(Menor)
Realizacion de un Proceso de Aportaciones al Documento Inicial de la ECAZ 3.0	Ayuntamiento		ATELIER DE IDEAS S.COOP,	8874	25/10/2018	Servicios(Menor)
DESARROLLO E IMPLANTACION DE LA APLICACION INFORMATICA CAPAZ PARA EL ARCHIVO MUNICIPAL	Ayuntamiento		KEENSOFT SOFTWARE,S.L	14999	25/10/2018	Servicios(Menor)
gestion de servicios conama	Ayuntamiento		FUNDACIÓN CONAMA	8264	23/10/2018	Servicios(Menor)
Suministro de 4 bombas dosificadoras helicoidades de 0,18 kw	Ayuntamiento		ADIEGO-HERMANOS-SA	2850	23/10/2018	Suministros(Menor)
ACONDICIONAMIENTO INSTALACION DEPORTIVA ELEMENTAL TORRECILLA DE VALMADRID, ZARAGOZA.	Ayuntamiento		SPORT OCIO PLUS,S.L.	16052	22/10/2018	Obras(Menor)
Suministro de sondas de turbidez de rango alto para la planta potabilizadora.	Ayuntamiento		CAMPBELL SCIENTIFIC SPAIN, S.L.	14936	22/10/2018	Suministros(Menor)
SUMINISTRO VARIADORES DE VELOCIDAD Y  ARMARIO PARA ADECUACION DE DOSIFICACION ALMIDON	Ayuntamiento		COMERCIAL HISPANOFIL,S.A.U.	4692	22/10/2018	Suministros(Menor)
Obras para realizar arreglos en solares (S.J.Pena, 80  Lugo, 128  Manresa, 1 P. Garces  M.P.Scho.)	Ayuntamiento		ÁRIDOS Y EXCAVACIONES CARMELO LOBERA, S.L. 	12600	22/10/2018	Obras(Menor)
SUMINISTRO DE PAVIMENTO DE CAUCHO PARA REPOSICION EN DISTINTAS ZONAS INFANTILES DE ZARAGOZA	Ayuntamiento		GALITEC DESARROLLOS TECNOLOGICOS	14999	22/10/2018	Suministros(Menor)
ACONDICIONAMIENTO INSTALACION DEPORTIVA ELEMENTAL LA CARTUJA, ZARAGOZA.	Ayuntamiento		SPORT OCIO PLUS,S.L.	33696	22/10/2018	Obras(Menor)
Sistema de sonorizacion del salon de recepciones del Ayuntamiento de Zaragoza	Ayuntamiento		INGENIER-Y-TELEC-ADDI-TELECOM-SL	11175	19/10/2018	Suministros(Menor)
DISENO, FABRICACION, TRASLADO Y MONTAJE DE ESTRUCTURA METALICA MODULAR EN MUSEO DEL FORO	Ayuntamiento		METALISTERIA MAV ZARAGOZA S.L.	7000	18/10/2018	Servicios(Menor)
Suministro tarjetas criptograficas	Ayuntamiento		REAL CASA DE LA MONEDA. FNMT	14965	17/10/2018	Suministros(Menor)
ADQUISICION CALIBRADOR MULTIPRODUCTO	Ayuntamiento		MEGACAL INSTRUMENTS IBERICA S.L. 	13744	16/10/2018	Suministros(Menor)
ADQUISICION GENERADOR DE IMPULSOS 1,2/50 µS	Ayuntamiento		INSTRUMENTACION Y COMPONENTES	11030	16/10/2018	Suministros(Menor)
ADQUISICION BOLETINES DE DENUNCIA PARA POLICIA LOCAL	Ayuntamiento		IMPRESIONES TRANSKRIT S.A. 	10366	15/10/2018	Suministros(Menor)
CONTRATO MENOR CURSO MANTENIMIENTO DE INST. RIESGO TRANSMISION LEGIONELLA. RECICLAJE. 4 EDICIONES	Ayuntamiento		AQQUA TRATAMIETNO INDUSTRIAL Y SANITARIO DEL AGUA,	4000	15/10/2018	Servicios(Menor)
SERVICIO DE ASISTENCIA TECNICA PARA CINCO ESTUDIOS GEOTECNICOS EN BARRIOS RURALES DE ZARAGOZA	Ayuntamiento		CONTROL 7 S.A.U.	8185	10/10/2018	Servicios(Menor)
Adquisicion y colocacion detectores humos, mayores 65 anos, con recursos escasos.	Ayuntamiento		FIREX-SL	14775	09/10/2018	Servicios(Menor)
Contrato derivado del Acuerdo Marco para el suministro de chalecos antiagresión mixtos  para la Policía Local	Ayuntamiento		FEDUR S.A.	87050	09/10/2018	Suministros(Basado en Acuerdo Marco)
APLICACION INFORMATICA GESTION DE TOMA DE MUESTRAS PARA EL INSTITUTO MPAL DE SALUD PUBLICA. ZARAGOZA	Ayuntamiento		INSTRUMENTACION Y COMPONENTES	13900	09/10/2018	Suministros(Menor)
SUMINISTRO  DE MATERIAL INFORMATICO PARA CASAS DE JUVENTUD	Ayuntamiento		CLD INFORMATICA	7187	08/10/2018	Suministros(Menor)
Contrato Menor de Servicios de Redaccion de Proyectos en diferentes barrios rurales de Zaragoza	Ayuntamiento		SERS CONSULTORES EN INGENIERIA Y ARQUITECTURA SAU	8628	05/10/2018	Servicios(Menor)
SUMINISTRO DE UN APILADOR DE ELEVACION Y TRASLACION ELECTRICA PARA EL SERV. DE INST. DEPORTIVAS	Ayuntamiento		FERRETERÍA ARIES S.A.	5670	04/10/2018	Suministros(Menor)
